{
  "schema_family": "raw-result",
  "schema_version": "v0",
  "adapter": {
    "name": "trivy",
    "version": "0.58.1"
  },
  "execution": {
    "execution_id": "exec-20260321-0001",
    "status": "failure",
    "started_at": "2026-03-21T09:15:00Z",
    "finished_at": "2026-03-21T09:15:08Z",
    "duration_ms": 8000,
    "exit_code": 1,
    "command": {
      "program": "trivy",
      "args": [
        "image",
        "--format",
        "json",
        "ghcr.io/example/app:1.2.3"
      ],
      "display": "trivy image --format json ghcr.io/example/app:1.2.3"
    },
    "outputs": {
      "stdout": {
        "path": "artifacts/raw/trivy/stdout.json",
        "media_type": "application/json",
        "byte_count": 58213
      },
      "stderr": {
        "path": "artifacts/raw/trivy/stderr.log",
        "media_type": "text/plain",
        "byte_count": 218
      }
    },
    "metadata": {
      "runner": "local",
      "target_kind": "container-image"
    }
  }
}